{
  "candidate": {
    "metadata": {
      "agent_id": "agent-a",
      "worktree_path": "/workspace/repository/.worktrees/agent-a",
      "branch": "agent/agent-a",
      "primary_repo_root": "/workspace/repository",
      "primary_head": "aaaaaaaaaaaaaaaaaaaaaaaaaaaaaaaaaaaaaaaa",
      "agent_head": "bbbbbbbbbbbbbbbbbbbbbbbbbbbbbbbbbbbbbbbb",
      "merge_base": "aaaaaaaaaaaaaaaaaaaaaaaaaaaaaaaaaaaaaaaa",
      "base_matches_primary": true
    },
    "claimed_paths": [
      "src/lib.rs"
    ],
    "changed_paths": [
      "src/lib.rs"
    ],
    "changes": [
      {
        "path": "src/lib.rs",
        "kind": "modified"
      }
    ],
    "unclaimed_changed_paths": [],
    "diff": {
      "summary": {
        "text": "diff --git a/src/lib.rs b/src/lib.rs\nindex 1111111111111111111111111111111111111111..2222222222222222222222222222222222222222 100644\n--- a/src/lib.rs\n+++ b/src/lib.rs\n@@ -1 +1 @@\n-pub fn old() {}\n+pub fn new() {}\n",
        "truncated": false
      },
      "full": "diff --git a/src/lib.rs b/src/lib.rs\nindex 1111111111111111111111111111111111111111..2222222222222222222222222222222222222222 100644\n--- a/src/lib.rs\n+++ b/src/lib.rs\n@@ -1 +1 @@\n-pub fn old() {}\n+pub fn new() {}\n"
    },
    "validations": [],
    "validation_binding": {
      "version": 1,
      "agent_id": "agent-a",
      "primary_head": "aaaaaaaaaaaaaaaaaaaaaaaaaaaaaaaaaaaaaaaa",
      "agent_head": "bbbbbbbbbbbbbbbbbbbbbbbbbbbbbbbbbbbbbbbb",
      "merge_base": "aaaaaaaaaaaaaaaaaaaaaaaaaaaaaaaaaaaaaaaa",
      "diff_oid": "de370353f8ed230e3a07c31f3a6c84dc68ba4eb1"
    }
  },
  "safety": {
    "primary_state_unchanged": {
      "status": "passed",
      "message": null,
      "paths": []
    },
    "dirty_primary": {
      "status": "passed",
      "message": null,
      "paths": []
    },
    "stale_base": {
      "status": "passed",
      "message": null,
      "paths": []
    },
    "apply_check": {
      "status": "passed",
      "message": null,
      "paths": []
    },
    "unclaimed_edits": {
      "status": "passed",
      "message": null,
      "paths": []
    },
    "validation": {
      "status": "skipped",
      "message": "validation was not required",
      "paths": []
    },
    "validation_evidence": {
      "status": "skipped",
      "binding_status": "not_required",
      "message": "validation evidence was not required",
      "paths": []
    },
    "megafile": {
      "status": "passed",
      "message": null,
      "paths": []
    },
    "megafile_warnings": [],
    "megafile_decomposition_target": null,
    "megafile_decomposition_evidence": null,
    "megafile_blocking": false,
    "validation_required": false,
    "candidate_validation_commands": [],
    "force_options": {
      "allow_dirty_primary": false,
      "allow_stale_base": false,
      "allow_unclaimed_edits": false,
      "allow_validation_failures": false,
      "allow_apply_conflicts": false
    },
    "apply_mode": "direct",
    "semantic_conflicts": {
      "advisory": true,
      "status": "classified",
      "risk": "high",
      "confidence": "high",
      "degraded": false,
      "notes": [
        "The candidate changes a signature imported by a dependent module."
      ],
      "conflict_paths": [
        "src/lib.rs"
      ],
      "overlaps": [
        {
          "path": "src/lib.rs",
          "kind": "signature_level",
          "risk": "high",
          "confidence": "high",
          "primary": {
            "touched_symbols": [
              {
                "name": "new",
                "qualified_path": [
                  "crate",
                  "new"
                ],
                "kind": "function",
                "visibility": "pub",
                "impl_target": null,
                "impl_trait": null,
                "file": "src/lib.rs"
              }
            ],
            "touched_impls": [],
            "touched_modules": [
              "crate"
            ],
            "touched_imports": [],
            "formatting_only": false,
            "import_only": false,
            "signature_level": true,
            "current_line_ranges": [
              {
                "start_line": 1,
                "end_line": 1
              }
            ],
            "base_line_ranges": [
              {
                "start_line": 1,
                "end_line": 1
              }
            ]
          },
          "candidate": {
            "touched_symbols": [
              {
                "name": "new",
                "qualified_path": [
                  "crate",
                  "new"
                ],
                "kind": "function",
                "visibility": "pub",
                "impl_target": null,
                "impl_trait": null,
                "file": "src/lib.rs"
              }
            ],
            "touched_impls": [],
            "touched_modules": [
              "crate"
            ],
            "touched_imports": [
              {
                "path": "crate::dependent",
                "alias": null,
                "glob": false,
                "visibility": "private"
              }
            ],
            "formatting_only": false,
            "import_only": false,
            "signature_level": true,
            "current_line_ranges": [
              {
                "start_line": 1,
                "end_line": 1
              }
            ],
            "base_line_ranges": [
              {
                "start_line": 1,
                "end_line": 1
              }
            ]
          },
          "common_symbols": [
            {
              "name": "new",
              "qualified_path": [
                "crate",
                "new"
              ],
              "kind": "function",
              "visibility": "pub",
              "impl_target": null,
              "impl_trait": null,
              "file": "src/lib.rs"
            }
          ],
          "common_impls": [],
          "common_modules": [
            "crate"
          ],
          "impacted_files": [
            "src/dependent.rs"
          ],
          "dependency_impacts": [
            {
              "side": "candidate",
              "impact": {
                "direction": "incoming",
                "changed_path": "src/lib.rs",
                "related_file": "src/dependent.rs",
                "dependency": {
                  "from_file": "src/dependent.rs",
                  "from_module": [
                    "crate",
                    "dependent"
                  ],
                  "to": "crate::new",
                  "to_file": "src/lib.rs",
                  "kind": "import",
                  "span": {
                    "start_byte": 0,
                    "end_byte": 19,
                    "start_line": 1,
                    "end_line": 1,
                    "signature_end_line": 1
                  }
                }
              }
            }
          ],
          "notes": [
            "A dependent import reaches the changed public signature."
          ]
        }
      ]
    },
    "readiness": {
      "status": "safe",
      "blockers": [],
      "forced": [],
      "details": []
    }
  },
  "freshness_watermark": {
    "version": 2,
    "primary": {
      "head": "aaaaaaaaaaaaaaaaaaaaaaaaaaaaaaaaaaaaaaaa",
      "index_digest": "cccccccccccccccccccccccccccccccccccccccc",
      "worktree_digest": "eeeeeeeeeeeeeeeeeeeeeeeeeeeeeeeeeeeeeeee"
    },
    "source": {
      "agent_id": "agent-a",
      "head": "bbbbbbbbbbbbbbbbbbbbbbbbbbbbbbbbbbbbbbbb"
    },
    "candidate": {
      "snapshot_tree": "ffffffffffffffffffffffffffffffffffffffff",
      "diff_oid": "de370353f8ed230e3a07c31f3a6c84dc68ba4eb1"
    },
    "base_preview": {
      "sha256": "d74a4abb704000da5254bc3e74b637fee1d6cab17e623da3e91de0c916969ed9"
    }
  },
  "review_intent": {
    "candidate_validation_commands": [],
    "require_validation_after_candidate": false,
    "auto_reap_merged": false,
    "trunk_ref": null,
    "apply_auto_reap": false
  }
}
